id,planet,house,sign,keywords,reading,is_positive,source_month,source_sign
1,太阳,10,摩羯座,"事业,荣誉,成就,新开始",12月30日发生在摩羯座的新月点亮了你星盘最顶端掌管荣誉、奖励和成就的第十宫。你的职业生活似乎翻开了新的篇章，可能会开始一份重要的新工作，或在现有岗位上被赋予新的职责。,TRUE,2025-01,白羊座
2,新月,10,摩羯座,"事业,长期影响,工作保障",这次新月对你的影响不是一天或一周，而是未来六个月。新月刚出现时会产生最强烈的震动，然后在六个月内逐渐减弱。,TRUE,2025-01,白羊座
3,土星,10,摩羯座,"稳定,长期合作,事业基础",土星，这颗稳定的行星，将处于鼓励你与新雇主建立长期合作关系的理想位置。土星是影响你事业的最主要行星。,TRUE,2025-01,白羊座
4,火星,5,狮子座,"爱情,创意,浪漫,逆行",本月开始时，你的主宰星火星仍将在你的爱情宫逆行。在这几周里，你的想象力和创造力得到了绝佳的绽放机会。你的心思可能在娱乐项目上，但也可能在浪漫上。,FALSE,2025-01,白羊座
5,火星,4,巨蟹座,"家庭,住所,家人,行动",1月6日火星将移至巨蟹座，进入你的家庭宫，并在那里停留数月。保持家中的正常运转将是当务之急。本月火星都会出界，而且表现得很强势。,TRUE,2025-01,白羊座
6,木星,3,双子座,"短途旅行,兄弟姐妹,沟通,社交",木星位于你的第三宫，也掌管着兄弟姐妹。亲朋好友会给你发来便条、信件、短信和电话，其中一些一定会让你感到温暖。可能会有一次短途旅行。,TRUE,2025-01,白羊座
7,天王星,2,金牛座,"财务,惊喜,逆行结束,资金",天王星自9月1日开始逆行，将于1月30日转为顺行，可能会释放你等待已久的资金。天王星位于你的收入第二宫，你可能得到有关金钱的好消息。,TRUE,2025-01,白羊座
8,冥王星,10,摩羯座,"权力,控制,职业变革",火星与冥王星对冲已久，1月上半月仍将处于对冲状态。你似乎遇到了一两个难缠的上司或客户，他们自我陶醉，寸步不让。,FALSE,2025-01,白羊座
