id,planet,house,sign,keywords,reading,is_positive,source_month,source_sign
1,天王星,10,狮子座,"事业,荣誉,成就,公众形象",进入七月之际，你最出色的工作都是在不被打扰的隐秘处悄然完成的。 六月的最后一周，象征不可预测事件的天王星与金星在你的第十宫事业宫形成了合相，这表明你的卓越声誉正在不断提升，看起来你很受上级、同事、下属的欢迎。你的才华、判断力，以及凝聚他人的能力，可能会出人意料地得到认可，但其实这并不奇怪——你确实做得非常出色。虽然你曾以为没人注意到你，或大家都低估了你，但你很快就会发现，事实并非如此——他们都在为...,TRUE,2025-07,狮子座
2,土星,8,狮子座,"他人钱财,转型,深度关系,遗产",但本月管理层或客户对你的高度赞赏可能会给你带来额外收入——对于此刻来说无疑是雪中送炭。另外，严厉教官土星一直在你的第八宫偏财宫中制约着财务增长，使得你的收入提升举步维艰。但这种局面即将迎来转机。 5月24日，土星撤离了第八宫，但这一次撤离较短暂，它将于9月1日再次进入第八宫。请保持信心，等到2026年2月13日，土星将彻底离开第八宫，这段漫长的财务修行之旅将至尾声。从某种意义上说，在土星这位严师的...,TRUE,2025-07,狮子座
3,金星,11,狮子座,"社交,朋友,群体,未来愿景",的某段跨国关系，为未来的成功铺路。 7月的生活并不是只有埋头工作而没有娱乐时光。7月4日~30日，金星进入你的第十一宫友谊宫，朋友们的邀约将纷至沓来，比如一对一的小聚、晚餐约会、派对、去朋友家做客等等。这个月既高效又充满乐趣，好好把握它。而种种迹象表明，八月的运势还会更上一层楼。 正文 生活正一天天悄然发生变化，但你现在可能还没有明显感觉到。再过几周，你就会看到越来越明朗的局势了，周围的环境也在变...,TRUE,2025-07,狮子座
4,天王星,11,狮子座,"社交,朋友,群体,未来愿景",。天王星是一颗极端的行星，它带来的事件既有大起也有大落，从劫难到奇遇，都有可能。 7 月 7 日，天王星将进入双子座和你的第十一宫，这个宫位代表社交友谊，以及你心中最深的期待和愿望。对于如此多变的天王星，这个宫位要友好很多。相对于事业上的不稳定，你会在社交领域迎来很多惊喜，这比事业的波折要更有趣和轻松。要知道，比起天王星在金牛座中与太阳的刑克（90度的艰难相位），它在新居所双子座时，对太阳的影响会...,TRUE,2025-07,狮子座
5,太阳,12,狮子座,"潜意识,独处,精神,秘密,结束",和扩张的木星与太阳、新月精准合相了，这使得木星的吉运与助力能够持续影响接下来的数周甚至数月。 你由太阳守护，而彼时太阳与木星在巨蟹座中只相距微小的度数（在360度中几乎贴合），整体星象格局堪称理想。太阳、新月与木星这三大星体同时落入你星盘中最隐秘的第十二宫。月初你会进入规划、筹备的状态，这正是一个很好的利用新月的方式。看起来你会特别乐观，这种积极情绪是有充分理由的。你的直觉将变得高度敏锐，所以不要...,TRUE,2025-07,狮子座
6,火星,2,狮子座,"财务,收入,价值观,物质资源",者，在你又长大一岁的当下，你可能想要好好思考和反省一下，想想在接下来这一年里想要实现的所有目标。 火星目前位于你的第二宫财务宫，所以你的支出可能比平时高。不过，在上个月，6月25日的新月与火星产生了联动【译注：接近60度六分相】，这表明你可能正在构思一个点子，并在7月初不断打磨它。迹象显示，这个想法可能具有盈利潜力，能为你当前的现金流带来不小的帮助。 你可能在一段跨国人际关系上遇到了些问题，或者正...,TRUE,2025-07,狮子座
